评论用户id,评论内容,评论提交时间
532024137,这家酒店的地理位置很理想。你可以通过一家地下购物中心进入酒店。在下雨天，那里有很多事情可以做，而不必弄湿自己。各式各样的商店、餐厅、快餐食物。电车站就在酒店大门旁边，使得乘坐电车游览城市很轻松方便。酒店的工作人员都很乐于助人、友善和热情。自助早餐非常好，大厅里的免费卡布奇诺咖啡机非常受欢迎。我们把房间升级到有一张更大的床和一台足部按摩器的房间。床很舒服，在结束许多天徒步游览城市后，按摩器感觉很棒。空调很棒，暗色的遮阳帘也是。很棒的地方！,2018-06-25 17:03:46
526732187,"位于路面电车站旁的商店街上离长崎JR 有点远，但讲物和去中华街就十分方便。房间整洁而且大，有iPad和可打电话的smartphone 还有按摩椅和小型腰部按摩器!十分意外!
酒店价格便宜! 再来长崎一定会再入住!",2018-06-05 12:26:21
516672176,太好了，一间一尘不染的房间，里面有舒适的大床。对日本来说，这个房间比大多数的房间都大。步行不远即可到达唐人街和许多餐馆，它们都在步行距离之内。它位于一个大约有4个街区的巨大购物区，但房间是隔音的，所以你不会听到（噪音）。,2018-04-23 17:25:27
388422331,Hotel Forza坐落在长崎交通便利的购物主街道，在这里你步行就可以很轻易的逛遍整个城市。很有餐馆只要漫步就能达到；北面较为平静，南面显得更加活跃热闹。房间功能齐全，大小也合适。需要值得一提的是，酒店内没有传统意义上的酒吧和饭店，但是在附近可以找到很多店，如24小时便利店。性价比很不错。下次来长崎我还会来这里。,2016-12-26 23:05:54
383249108,这家酒店真是一个惊喜。它非常的新（开业甚至不到两年），房间虽然很小，但是非常不错。床很舒适，浴室很大，带步入式淋浴，冰箱随你处置，还有很多设施（甚至提供了一个iPad），他们的隔音措施做得非常好。工作人员，尽管有时候因为语言差异在沟通方面有点困难，总是尽职尽责。酒店毗邻电车站，每分钟都有好几辆出租车经过。接待处旁边有两个自助洗衣店。早餐物有所值，另外这一地区还有很多不错的餐馆。,2016-12-02 23:04:55
369734541,饭店非常的新，饭店在公车站附近，交通非常便利，饭店服务非常好，大厅有免费咖啡可以取用，不过房间有点小，但设备非常好，桌上还有一台Ipad可以查长崎市旅游的资讯，非常好的体验。,2016-10-15 02:17:41
369645693,Forza酒店地理位置优越。刚好位于有轨电车线经过长崎的地方，使它方便到达所有的长崎景点。入口有点难找。只要进入购物中心，往左边看就是它了。房间位于较小的一面，但是很多日式的酒店房间都这样。但是提供所有的便利设施。很棒的早餐，不错的服务。房间里的带多功能充电站的美式插座非常赞！这是我们在长崎很棒的住宿选择！,2016-10-14 23:15:13
357532649,这是一家很不错的酒店，在我整个三星期半的旅程中，这家的房间是我住过的最好的。房间规格是常规大小，浴室特别好。房间里放了一台大屏电视和一张双人床。酒店员工都非常乐于助人，他们一切以你为中心，而且这里很安静。唯一一点不太好的就是酒店没有设置专门的吸烟室，所以一旦有人在房间里抽烟，味道就会散得到处都是。,2016-09-07 23:17:44
341124873,酒店位置极佳，位于观光通这个购物集中地，一出就系电车站，房间入面干净企理，拖鞋及牙擦俾一般中价酒店为佳，床都好舒服，下次再到长崎的话会再入住,2016-07-31 10:13:29
340770230,"设备：感觉新且干净
地点：楼下就是商店街，逛街买东西超级方便
早餐：不到丰盛，但端出来的都蛮好吃的
服务人员：态度很好，有问必应
停车：无，因为位于闹区所以需自己附近找车位 要花一些时间
整体来说，值得推荐",2016-07-30 10:25:48
340768969,饭店在路面电车的「观光通站」下车，步行不用一分钟，饭店出来就是观光通商店街，美食也很多，眼镜桥、出岛或长崎港…步行就可以沿路参观，地理位置真的很棒。饭店人员服务也超好，女生入住还可以挑选一些用品使用。房间很大也很干净，双人床很好睡超舒服，浴室也很大都不会很拥挤，友人住的是二张床的房间，浴室和厕所是分开的，很适合家庭入住。房间还有附一台小型按摩机。退房后还可以寄放行李，超贴心，下次有机会还是会入住这间饭店。,2016-07-30 10:20:00
339086216,"很棒的地理位置，位于购物商场的入口处。前台服务有四级水平，所以安静而且不过问私事。这个地方似乎很新,所以一切都有很好的形态。员工英语水平很高，还乐于助人。我乘火车到达后,还能在火车站前直接坐有轨电车(只要120日元)到酒店右边的门外,非常简单。早餐和咖啡还行，一般般。",2016-07-26 17:13:40
335968496,酒店处于电车站和有顶棚的购物街的前面，位置非常便利，是长崎一个很好的住宿之地。作为一个当地的连锁酒店，工作人员能讲的英语十分有限，但他们的确会尽自己最大的努力，为我们预订餐馆，使用翻译软件让我们得知结果。这里提供免费的咖啡和热巧克力，这是很受欢迎的。,2016-07-19 17:04:47
